{
    "$schema": "Set-ADCSFirewallPolicy.schema.json",
    "GroupPolicyObjectName": "Certification Authority Firewall",
    "GroupPolicyObjectComment": "This GPO is managed by the Set-ADCSFirewallPolicy.ps1 PowerShell script.",
    "TargetDomain": "contoso.com",
    "LogDroppedPackets": true,
    "LogAllowedPackets": false,
    "LogFilePath": "%systemroot%\\system32\\logfiles\\firewall\\pfirewall.log",
    "LogMaxSizeKilobytes": 128,
    "ClientAddresses": [ "10.220.2.0/24", "10.220.4.0/24", "10.220.5.0/24", "10.220.6.0/24" ],
    "ManagementAddresses": [ "10.220.3.0/24" ],
    "DomainControllerAddresses": [ "10.220.1.0/24" ],
    "RadiusClientAddresses": [ "10.220.1.12/32", "10.220.1.13/32" ],
    "NtdsStaticPort": 38901,
    "NetlogonStaticPort": 38902,
    "FrsStaticPort": 38903,
    "DfsrStaticPort": 5722,
    "WmiStaticPort": true,
    "RestrictADWS": true,
    "DisableNetbiosBroadcasts": true,
    "DisableLLMNR": true,
    "DisableMDNS": true,
    "BlockManagementFromDomainControllers": false,
    "EnableServiceManagement": true,
    "EnableEventLogManagement": true,
    "EnableScheduledTaskManagement": true,
    "EnableWindowsRemoteManagement": true,
    "EnablePerformanceLogAccess": true,
    "EnableOpenSSHServer": false,
    "EnableRemoteDesktop": true,
    "EnableDiskManagement": true,
    "EnableBackupManagement": true,
    "EnableFirewallManagement": false,
    "EnableComPlusManagement": true,
    "EnableLegacyFileReplication": false,
    "EnableNetbiosNameService": false,
    "EnableNetbiosDatagramService": false,
    "EnableNetbiosSessionService": false,
    "EnableWINS": false,
    "EnableDhcpServer": false,
    "EnableNPS": false,
    "EnableKMS": false,
    "EnableWSUS": false,
    "EnableWDS": false,
    "EnableWebServer": false,
    "EnableFSRMManagement": false,
    "EnablePrintSpooler": false,
    "EnableNetworkProtection": true,
    "BlockWmiCommandExecution": true,
    "EnableRpcFilters": true,
    "EnableLocalIPsecRules": false,
    "CustomRuleFileNames": null
}